{
  "$schema": "https://json-schema.org/draft/2020-12/schema",
  "$id": "https://raw.githubusercontent.com/jwaspin/luca-ledger/main/schemas/v2.0/category.json",
  "title": "Category",
  "description": "Defines the schema for categories used to organize transactions within a ledger application. Categories can be default, modified, or custom, providing flexibility in categorization.",
  "type": "object",
  "properties": {
    "id": {
      "type": "string",
      "description": "A unique identifier for the category."
    },
    "name": {
      "type": "string",
      "description": "The name of the category."
    },
    "description": {
      "type": ["string", "null"],
      "description": "A description of the category, providing additional context. Can be null if not specified."
    },
    "parentId": {
      "type": ["string", "null"],
      "description": "The identifier of the parent category, if any. Null if the category is top-level."
    },
    "defaultCategoryId": {
      "type": ["string", "null"],
      "description": "For custom categories, this indicates the default category from which this was derived. Required if categoryType is CUSTOM."
    },
    "categoryType": {
      "type": "string",
      "enum": ["DEFAULT", "MODIFIED", "CUSTOM"],
      "description": "The type of the category, indicating whether it is a default, modified, or custom category."
    },
    "createdAt": {
      "type": "string",
      "format": "date-time",
      "description": "The date and time when the category was created, in ISO 8601 format."
    },
    "updatedAt": {
      "type": ["string", "null"],
      "format": "date-time",
      "description": "The date and time when the category was last updated, in ISO 8601 format. Can be null if the category has never been updated."
    }
  },
  "required": ["id", "name", "createdAt", "categoryType"],
  "additionalProperties": false,
  "if": {
    "properties": {
      "categoryType": {
        "const": "MODIFIED"
      }
    }
  },
  "then": {
    "required": ["defaultCategoryId"]
  }
}
